{
  "$schema": "https://github.com/glzr-io/zebar/raw/v3.3.1/resources/zpack-schema.json",
  "name": "omarchy",
  "version": "1.0.0",
  "description": "Omarchy-style Tokyo Night top bar for GlazeWM on Windows.",
  "tags": ["bar", "glazewm", "tokyo-night", "omarchy"],
  "previewImages": [],
  "repositoryUrl": "",
  "widgets": [
    {
      "name": "bar",
      "htmlPath": "./bar.html",
      "zOrder": "normal",
      "shownInTaskbar": false,
      "focused": false,
      "resizable": false,
      "transparent": true,
      "includeFiles": ["*.html", "*.css"],
      "presets": [
        {
          "name": "default",
          "anchor": "top_center",
          "offsetX": "0px",
          "offsetY": "0px",
          "width": "100%",
          "height": "40px",
          "monitorSelection": {
            "type": "all"
          },
          "dockToEdge": {
            "enabled": false,
            "edge": null,
            "windowMargin": "0px"
          }
        }
      ]
    }
  ]
}
